|author|body|dynasty|name
328|张元干|梦绕神州路。怅秋风、连营画角，故宫离黍。底事昆仑倾砥柱。九地黄流乱注。聚万落、千村狐兔。天意从来高难问，况人情、老易悲如许。更南浦，送君去。凉生岸柳催残暑。耿斜河、疏星淡月，断云微度。万里江山知何处。回首对床夜语。雁不到、书成谁与。目尽青天怀今古，肯儿曹、恩怨相尔汝。举大白，听金缕。|宋|贺新郎·送胡邦衡待制赴新州
329|刘克庄|湛湛长空黑。更那堪、斜风细雨，乱愁如织。老眼平生空四海，赖有高楼百尺。看浩荡、千崖秋色。白发书生神州泪，尽凄凉、不向牛山滴。追往事，去无迹。少年自负凌云笔。到而今、春华落尽，满怀萧瑟。常恨世人新意少，爱说南朝狂客。把破帽、年年拈出。若对黄花孤负酒，怕黄花、也笑人岑寂。鸿北去，日西匿。|宋|贺新郎·九日
330|李益|天山雪后海风寒，横笛偏吹行路难。碛里征人三十万，一时回向月明看。|唐|从军北征
331|刘长卿|万里辞家事鼓鼙，金陵驿路楚云西。江春不肯留归客，草色青青送马蹄。|唐|送李判官之润州行营
332|杜甫|村晚惊风度，庭幽过雨沾。夕阳薰细草，江色映疏帘。书乱谁能帙，怀干可自添。时闻有馀论，未怪老夫潜。|唐|晚晴
333|佚名|二子乘舟，泛泛其景。愿言思子，中心养养！二子乘舟，泛泛其逝。愿言思子，不瑕有害？|先秦|二子乘舟
334|曹丕|上山采薇，薄暮苦饥。溪谷多风，霜露沾衣。野雉群雊，猿猴相追。还望故乡，郁何垒垒！高山有崖，林木有枝。忧来无方，人莫之知。人生如寄，多忧何为？今我不乐，岁月如驰。汤汤川流，中有行舟。随波转薄，有似客游。策我良马，被我轻裘。载驰载驱，聊以忘忧。|魏晋|善哉行·其一
335|王维|厌见千门万户，经过北里南邻。官府鸣珂有底，崆峒散发何人。|唐|田园乐七首·其一
336|刘长卿|春风倚棹阖闾城，水国春寒阴复晴。细雨湿衣看不见，闲花落地听无声。日斜江上孤帆影，草绿湖南万里情。东道若逢相识问，青袍今日误儒生。|唐|别严士元
337|王维|山下孤烟远村，天边独树高原。一瓢颜回陋巷，五柳先生对门。|唐|田园乐七首·其五
338|柳宗元|今夕少愉乐，起坐开清尊。举觞酹先酒，为我驱忧烦。须臾心自殊，顿觉天地暄。连山变幽晦，绿水函晏温。蔼蔼南郭门，树木一何繁。清阴可自庇，竟夕闻佳言。尽醉无复辞，偃卧有芳荪。彼哉晋楚富，此道未必存。|唐|饮酒
339|张乔|调角断清秋，征人倚戍楼。春风对青冢，白日落梁州。大汉无兵阻，穷边有客游。蕃情似此水，长愿向南流。|唐|书边事
340|岑参|轮台城头夜吹角，轮台城北旄头落。羽书昨夜过渠黎，单于已在金山西。戍楼西望烟尘黑，汉兵屯在轮台北。上将拥旄西出征，平明吹笛大军行。四边伐鼓雪海涌，三军大呼阴山动。虏塞兵气连云屯，战场白骨缠草根。剑河风急雪片阔，沙口石冻马蹄脱。亚相勤王甘苦辛，誓将报主静边尘。古来青史谁不见，今见功名胜古人。|唐|轮台歌奉送封大夫出师西征
341|佚名|客从远方来，遗我一端绮。相去万余里，故人心尚尔。文采双鸳鸯，裁为合欢被。著以长相思，缘以结不解。以胶投漆中，谁能别离此？|汉|客从远方来
342|杜甫|戚戚去故里，悠悠赴交河。公家有程期，亡命婴祸罗。君已富土境，开边一何多。弃绝父母恩，吞声行负戈。出门日已远，不受徒旅欺。骨肉恩岂断，男儿死无时。走马脱辔头，手中挑青丝。捷下万仞冈，俯身试搴旗。磨刀呜咽水，水赤刃伤手。欲轻肠断声，心绪乱已久。丈夫誓许国，愤惋复何有。功名图骐驎，战骨当速朽。送徒既有长，远戍亦有身。生死向前去，不劳吏怒嗔。路逢相识人，附书与六亲。哀哉两决绝，不复同苦辛。迢迢万馀里，领我赴三军。军中异苦乐，主将宁尽闻。隔河见胡骑，倏忽数百群。我始为奴仆，几时树功勋。挽弓当挽强，用箭当用长。射人先射马，擒贼先擒王。杀人亦有限，列国自有疆。苟能制侵陵，岂在多杀伤。驱马天雨雪，军行入高山。径危抱寒石，指落曾冰间。已去汉月远，何时筑城还。浮云暮南征，可望不可攀。单于寇我垒，百里风尘昏。雄剑四五动，彼军为我奔。虏其名王归，系颈授辕门。潜身备行列，一胜何足论。从军十年馀，能无分寸功。众人贵苟得，欲语羞雷同。中原有斗争，况在狄与戎。丈夫四方志，安可辞固穷。|唐|前出塞九首
343|韦庄|曾为流离惯别家，等闲挥袂客天涯。灯前一觉江南梦，惆怅起来山月斜。|唐|含山店梦觉作
344|沈佺期|闻道黄龙戍，频年不解兵。可怜闺里月，长在汉家营。少妇今春意，良人昨夜情。谁能将旗鼓，一为取龙城。|唐|杂诗三首·其三
345|祢衡|惟西域之灵鸟兮，挺自然之奇姿。体全精之妙质兮，合火德之明辉。性辩慧而能言兮，才聪明以识机。故其嬉游高峻，栖跱幽深。飞不妄集，翔必择林。绀趾丹嘴，绿衣翠矜。采采丽容，咬咬好音。虽同族于羽毛，固殊智而异心。配鸾皇而等美，焉比德于众禽！于是羡芳声之远畅，伟灵表之可嘉。命虞人于陇坻，诏伯益于流沙，跨昆仑而播戈，冠云霓而张罗。虽纲维之备设，终一目之所加。且其容止闲暇，守植安停。逼之不惧，抚之不惊。宁顺从以远害，不违迕以丧身。故献金者受赏，而伤肌者被刑。尔乃归穷委命，离群丧侣。闭以雕笼，剪其翅羽。流飘万里，崎岖重阻。踰岷越障，载罹寒暑。女辞家而适人，臣出身而事主。彼贤哲之逢患，犹栖迟以羁旅。矧禽鸟之微物，能驯拢以安处。眷西路而长怀，望故乡而延。忖陋体之腥臊，亦何劳于鼎俎？嗟禄命之衰薄，奚遭时之险巇？岂言语以阶乱，将不密以致危？痛母子之永隔，哀伉俪之生离。匪余年之足惜，悯众雏之无知。背蛮夷之下国，侍君子之光仪。惧名实之不副，耻才能之无奇。羡西都之沃壤，识苦乐之异宜。怀代越之悠思，故每言而称斯。若乃少昊司辰，蓐收整辔。严霜初降，凉风萧瑟。长吟远慕，哀鸣感类。音声凄以激扬，容貌惨以憔悴。闻之者悲伤，见之者陨泪。放臣为之屡叹，弃妻为之歔欷。感平身之游处，若壎篪之相须。何今日之两绝，若胡越之异区。顺笼槛以俯仰，窥户牖以踟躇。想昆仑之高岳，思邓林之扶疏。顾六翮之残毁，虽奋迅其焉如？心怀归而弗果，徒怨毒于一隅。苟竭心于所事，敢背惠而忘初！托轻鄙之微命，委陋贱于薄躯。期守死以抱德，甘尽辞以效愚。恃隆恩于既往，庶弥久而不渝。|汉|鹦鹉赋
346|杨万里|溪水将桥不复回，小舟犹倚短篙开。交情得似山溪渡，不管风波去又来。|宋|三江小渡
347|姚鼐|布谷飞飞劝早耕，舂锄扑扑趁春睛。千层石树遥行路，一带山田放水声。|清|山行·布谷飞飞劝早耕
348|戚继光|十年驱驰海色寒，孤臣于此望宸銮。繁霜尽是心头血，洒向千峰秋叶丹。|明|望阙台
349|晏几道|留人不住。醉解兰舟去。一棹碧涛春水路。过尽晓莺啼处。渡头杨柳青青。枝枝叶叶离情。此后锦书休寄，画楼云雨无凭。|宋|清平乐·留人不住
350|王维|采菱渡头风急，策杖林西日斜。杏树坛边渔父，桃花源里人家。|唐|田园乐七首·其三
351|李珣|古庙依青嶂，行宫枕碧流。水声山色锁妆楼。往事思悠悠。云雨朝还暮，烟花春复秋。啼猿何必近孤舟。行客自多愁。|唐|巫山一段云·古庙依青嶂
352|杜甫|绿竹半含箨，新梢才出墙。色侵书帙晚，阴过酒樽凉。雨洗娟娟净，风吹细细香。但令无剪伐，会见拂云长。|唐|严郑公宅同咏竹
353|陶渊明|久去山泽游，浪莽林野娱。试携子侄辈，披榛步荒墟。徘徊丘垄间，依依昔人居。井灶有遗处，桑竹残杇株。借问采薪者，此人皆焉如？薪者向我言，死没无复余。一世异朝市，此语真不虚。人生似幻化，终当归空无。|魏晋|归园田居·其四
354|王维|屋上春鸠鸣，村边杏花白。持斧伐远扬，荷锄觇泉脉。归燕识故巢，旧人看新历。临觞忽不御，惆怅远行客。|唐|春中田园作
355|杨慎|高田如楼梯，平田如棋局。白鹭忽飞来，点破秧针绿。|明|出郊
356|殷尧藩|鹤发垂肩尺许长，离家三十五端阳。儿童见说深惊讶，却问何方是故乡。|唐|同州端午
357|程颢|芳原绿野恣行事，春入遥山碧四围。兴逐乱红穿柳巷，困临流水坐苔矶。莫辞盏酒十分劝，只恐风花一片飞。况是清明好天气，不妨游衍莫忘归。|宋|郊行即事
358|王维|寂寞掩柴扉，苍茫对落晖。鹤巢松树遍，人访荜门稀。绿竹含新粉，红莲落故衣。渡头烟火起，处处采菱归。|唐|山居即事
359|韦应物|兵卫森画戟，宴寝凝清香。海上风雨至，逍遥池阁凉。烦疴近消散，嘉宾复满堂。自惭居处崇，未睹斯民康。理会是非遣，性达形迹忘。鲜肥属时禁，蔬果幸见尝。俯饮一杯酒，仰聆金玉章。神欢体自轻，意欲凌风翔。吴中盛文史，群彦今汪洋。方知大藩地，岂曰财赋疆。|唐|郡斋雨中与诸文士燕集
360|杜甫|坦腹江亭暖，长吟野望时。水流心不竞，云在意俱迟。寂寂春将晚，欣欣物自私。故林归未得，排闷强裁诗。|唐|江亭
361|刘基|城外萧萧北风起，城上健儿吹落耳。将军玉帐貂鼠衣，手持酒杯看雪飞。|明|北风行
362|柳永|当初聚散。便唤作、无由再逢伊面。近日来、不期而会重欢宴。向尊前、闲暇里，敛著眉儿长叹。惹起旧愁无限。盈盈泪眼。漫向我耳边，作万般幽怨。奈你自家心下，有事难见。待信真个，恁别无萦绊。不免收心，共伊长远。|宋|秋夜月·当初聚散
363|李颀|男儿事长征，少小幽燕客。赌胜马蹄下，由来轻七尺。杀人莫敢前，须如猬毛磔。黄云陇底白雪飞，未得报恩不能归。辽东小妇年十五，惯弹琵琶解歌舞。今为羌笛出塞声，使我三军泪如雨。|唐|古意
364|柳永|拆桐花烂漫，乍疏雨、洗清明。正艳杏浇林，缃桃绣野，芳景如屏。倾城。尽寻胜去，骤雕鞍紺幰出郊坰。风暖繁弦脆管，万家竞奏新声。盈盈。斗草踏青。人艳冶、递逢迎。向路傍往往，遗簪堕珥，珠翠纵横。欢情。对佳丽地，信金罍罄竭玉山倾。拚却明朝永日，画堂一枕春酲。|宋|木兰花慢·拆桐花烂漫
365|叶清臣|满斟绿醑留君住。莫匆匆归去。三分春色二分愁，更一分风雨。花开花谢、都来几许。且高歌休诉。不知来岁牡丹时，再相逢何处。|宋|贺圣朝·留别
366|陈羽|海畔风吹冻泥裂，枯桐叶落枝梢折。横笛闻声不见人，红旗直上天山雪。|唐|从军行
367|于鹄|巴女骑牛唱竹枝，藕丝菱叶傍江时。不愁日暮还家错，记得芭蕉出槿篱。|唐|巴女谣
368|韦庄|四月十七，正是去年今日，别君时。忍泪佯低面，含羞半敛眉。不知魂已断，空有梦相随。除却天边月，没人知。|唐|女冠子·四月十七
369|薛涛|水国蒹葭夜有霜，月寒山色共苍苍。谁言千里自今夕，离梦杳如关塞长。|唐|送友人
370|吴文英|听风听雨过清明。愁草瘗花铭。楼前绿暗分携路，一丝柳、一寸柔情。料峭春寒中酒，交加晓梦啼莺。西园日日扫林亭。依旧赏新晴。黄蜂频扑秋千索，有当时、纤手香凝。惆怅双鸳不到，幽阶一夜苔生。|宋|风入松·听风听雨过清明
371|李颀|秦川朝望迥，日出正东峰。远近山河净，逶迤城阙重。秋声万户竹，寒色五陵松。客有归欤叹，凄其霜露浓。|唐|望秦川·秦川朝望迥
372|孟郊|飒飒秋风生，愁人怨离别。含情两相向，欲语气先咽。心曲千万端，悲来却难说。别后唯所思，天涯共明月。|唐|古怨别
373|欧阳修|南园春半踏青时，风和闻马嘶。青梅如豆柳如眉，日长蝴蝶飞。花露重，草烟低，人家帘幕垂。秋千慵困解罗衣，画堂双燕归。|宋|阮郎归·南园春半踏青时
374|晏几道|小令尊前见玉箫。银灯一曲太妖娆。歌中醉倒谁能恨，唱罢归来酒未消。春悄悄，夜迢迢。碧云天共楚宫遥。梦魂惯得无拘检，又踏杨花过谢桥。|宋|鹧鸪天·小令尊前见玉箫
375|李白|去年战桑干源，今年战葱河道。洗兵条支海上波，放马天山雪中草。万里长征战，三军尽衰老。匈奴以杀戮为耕作，古来唯见白骨黄沙田。秦家筑城避胡处，汉家还有烽火然。烽火然不息，征战无已时。野战格斗死，败马号鸣向天悲。乌鸢啄人肠，衔飞上挂枯树枝。士卒涂草莽，将军空尔为。乃知兵者是凶器，圣人不得已而用之。|唐|战城南
376|温庭筠|荒戍落黄叶，浩然离故关。高风汉阳渡，初日郢门山。江上几人在，天涯孤棹还。何当重相见，尊酒慰离颜。|唐|送人东游
377|秦观|树绕村庄。水满坡塘。倚东风、豪兴徜徉。小园几许，收尽春光。有桃花红，李花白，菜花黄。远远围墙。隐隐茅堂。扬青旗、流水桥傍。偶然乘兴，步过东冈。正莺儿啼，燕儿舞，蝶儿忙。|宋|行香子·树绕村庄
378|佚名|战城南，死郭北，野死不葬乌可食。为我谓乌：且为客豪！野死谅不葬，腐肉安能去子逃？水深激激，蒲苇冥冥；枭骑战斗死，驽马徘徊鸣。梁筑室，何以南？何以北？禾黍不获君何食？愿为忠臣安可得？思子良臣，良臣诚可思：朝行出攻，暮不夜归！|汉|战城南
379|葛长庚|江上春山远，山下暮云长。相留相送，时见双燕语风樯。满目飞花万点，回首故人千里，把酒沃愁肠。回雁峰前路，烟树正苍苍。漏声残，灯焰短，马蹄香。浮云飞絮，一身将影向潇湘。多少风前月下，迤逦天涯海角，魂梦亦凄凉。又是春将暮，无语对斜阳。|宋|水调歌头·江上春山远
380|杜甫|男儿生世间，及壮当封侯。战伐有功业，焉能守旧丘。召募赴蓟门，军动不可留。千金买马鞭，百金装刀头。闾里送我行，亲戚拥道周。斑白居上列，酒酣进庶羞。少年别有赠，含笑看吴钩。朝进东门营，暮上河阳桥。落日照大旗，马鸣风萧萧。平沙列万幕，部伍各见招。中天悬明月，令严夜寂寥。悲笳数声动，壮士惨不骄。借问大将谁，恐是霍嫖姚。古人重守边，今人重高勋。岂知英雄主，出师亘长云。六合已一家，四夷且孤军。遂使貔虎士，奋身勇所闻。拔剑击大荒，日收胡马群。誓开玄冥北，持以奉吾君。献凯日继踵，两蕃静无虞。渔阳豪侠地，击鼓吹笙竽。云帆转辽海，粳稻来东吴。越罗与楚练，照耀舆台躯。主将位益崇，气骄凌上都。边人不敢议，议者死路衢。我本良家子，出师亦多门。将骄益愁思，身贵不足论。跃马二十年，恐辜明主恩。坐见幽州骑，长驱河洛昏。中夜间道归，故里但空村。恶名幸脱免，穷老无儿孙。|唐|后出塞五首
381|戴叔伦|汉家旌帜满阴山，不遣胡儿匹马还。愿得此身长报国，何须生入玉门关。|唐|塞上曲二首·其二
382|张炎|清明时节雨声哗。潮拥渡头沙。翻被梨花冷看，人生苦恋天涯。燕帘莺户，云窗雾阁，酒醒啼鸦。折得一枝杨柳，归来插向谁家。|宋|朝中措·清明时节
383|韩愈|纤云四卷天无河，清风吹空月舒波。沙平水息声影绝，一杯相属君当歌。君歌声酸辞且苦，不能听终泪如雨。洞庭连天九疑高，蛟龙出没猩鼯号。十生九死到官所，幽居默默如藏逃。下床畏蛇食畏药，海气湿蛰熏腥臊。昨者州前捶大鼓，嗣皇继圣登夔皋。赦书一日行万里，罪从大辟皆除死。迁者追回流者还，涤瑕荡垢清朝班。州家申名使家抑，坎轲只得移荆蛮。判司卑官不堪说，未免捶楚尘埃间。同时辈流多上道，天路幽险难追攀。君歌且休听我歌，我歌今与君殊科。一年明月今宵多，人生由命非由他。有酒不饮奈明何。|唐|八月十五夜赠张功曹
384|戴复古|小桃无主自开花，烟草茫茫带晓鸦。几处败垣围故井，向来一一是人家。|宋|淮村兵后
385|柳永|陇首云飞，江边日晚，烟波满目凭阑久。立望关河萧索，千里清秋。忍凝眸。杳杳神京，盈盈仙子，别来锦字终难偶。断雁无凭，冉冉飞下汀洲。思悠悠。暗想当初，有多少、幽欢佳会，岂知聚散难期，翻成雨恨云愁。阻追游。每登山临水，惹起平生心事，一场消黯，永日无言，却下层楼。|宋|曲玉管·陇首云飞
386|辛弃疾|汉中开汉业，问此地、是耶非。想剑指三秦，君王得意，一战东归。追亡事、今不见，但山川满目泪沾衣。落日胡尘未断，西风塞马空肥。一编书是帝王师。小试去征西。更草草离筵，匆匆去路，愁满旌旗。君思我、回首处，正江涵秋影雁初飞。安得车轮四角，不堪带减腰围。|宋|木兰花慢·席上送张仲固帅兴元
387|张舜民|水绕陂田竹绕篱，榆钱落尽槿花稀。夕阳牛背无人卧，带得寒鸦两两归。|宋|村居
388|宋祁|燕子呢喃，景色乍长春昼。睹园林、万花如绣。海棠经雨胭脂透。柳展宫眉，翠拂行人首。向郊原踏青，恣歌携手。醉醺醺、尚寻芳酒。问牧童、遥指孤村道：“杏花深处，那里人家有。”|宋|锦缠道·燕子呢喃
389|杜甫|孟冬十郡良家子，血作陈陶泽中水。野旷天清无战声，四万义军同日死。群胡归来血洗箭，仍唱胡歌饮都市。都人回面向北啼，日夜更望官军至。|唐|悲陈陶
390|佚名|十亩之间兮，桑者闲闲兮，行与子还兮。十亩之外兮，桑者泄泄兮，行与子逝兮。|先秦|十亩之间
391|王安石|平岸小桥千嶂抱。柔蓝一水萦花草。茅屋数间窗窈窕。尘不到。时时自有春风扫。午枕觉来闻语鸟。欹眠似听朝鸡早。忽忆故人今总老。贪梦好。茫然忘了邯郸道。|宋|渔家傲·平岸小桥千嶂抱
392|陆游|禹庙兰亭今古路。一夜清霜，染尽湖边树。鹦鹉杯深君莫诉。他时相遇知何处。冉冉年华留不住。镜里朱颜，毕竟消磨去。一句丁宁君记取。神仙须是闲人做。|宋|蝶恋花·禹庙兰亭今古路
393|陈琳|饮马长城窟，水寒伤马骨。往谓长城吏，慎莫稽留太原卒！官作自有程，举筑谐汝声！男儿宁当格斗死，何能怫郁筑长城。长城何连连，连连三千里。边城多健少，内舍多寡妇。作书与内舍，便嫁莫留住。善待新姑嫜，时时念我故夫子！报书往边地，君今出语一何鄙？身在祸难中，何为稽留他家子？生男慎莫举，生女哺用脯。君独不见长城下，死人骸骨相撑拄。结发行事君，慊慊心意关。明知边地苦，贱妾何能久自全？|魏晋|饮马长城窟行
394|骆宾王|寒更承夜永，凉夕向秋澄。离心何以赠，自有玉壶冰。|唐|送别
395|欧阳修|花光浓烂柳轻明，酌酒花前送我行。我亦且如常日醉，莫教弦管作离声。|宋|别滁
396|王昌龄|蝉鸣空桑林，八月萧关道。出塞入塞寒，处处黄芦草。从来幽并客，皆共沙尘老。莫学游侠儿，矜夸紫骝好。|唐|塞上曲·其一
397|卢纶|鹫翎金仆姑，燕尾绣蝥弧。独立扬新令，千营共一呼。|唐|和张仆射塞下曲·其一
398|岑参|弯弯月出挂城头，城头月出照凉州。凉州七里十万家，胡人半解弹琵琶。琵琶一曲肠堪断，风萧萧兮夜漫漫。河西幕中多故人，故人别来三五春。花门楼前见秋草，岂能贫贱相看老。一生大笑能几回，斗酒相逢须醉倒。|唐|凉州馆中与诸判官夜集
399|辛弃疾|陈同父自东阳来过余，留十日。与之同游鹅湖，且会朱晦庵于紫溪，不至，飘然东归。既别之明日，余意中殊恋恋，复欲追路。至鹭鸶林，则雪深泥滑，不得前矣。独饮方村，怅然久之，颇恨挽留之正是遂也。夜半投宿吴氏泉湖四望楼，闻邻笛悲甚，为赋《贺新郎》以见意。又五日，同父书来索词，心所同然者如此，可发千里一笑。把酒长亭说。看渊明、风流酷似，卧龙诸葛。何处飞来林间鹊，蹙踏松梢微雪。要破帽多添华发。剩水残山无态度，被疏梅料理成风月。两三雁，也萧瑟。佳人重约还轻别。怅清江、天寒不渡，水深冰合。路断车轮生四角，此地行人销骨。问谁使、君来愁绝？铸就而今相思错，料当初、费尽人间铁。长夜笛，莫吹裂。|宋|贺新郎·把酒长亭说
400|岑参|火山五月行人少，看君马去疾如鸟。都护行营太白西，角声一动胡天晓。|唐|武威送刘判官赴碛西行军
401|白居易|母别子，子别母，白日无光哭声苦。关西骠骑大将军，去年破虏新策勋。敕赐金钱二百万，洛阳迎得如花人。新人迎来旧人弃，掌上莲花眼中刺。迎新弃旧未足悲，悲在君家留两儿。一始扶行一初坐，坐啼行哭牵人衣。以汝夫妇新燕婉，使我母子生别离。不如林中乌与鹊，母不失雏雄伴雌。应似园中桃李树，花落随风子在枝。新人新人听我语，洛阳无限红楼女。但愿将军重立功，更有新人胜于汝。|唐|母别子
402|张孝祥|江山自雄丽，风露与高寒。寄声月姊，借我玉鉴此中看。幽壑鱼龙悲啸，倒影星辰摇动，海气夜漫漫。涌起白银阙，危驻紫金山。表独立，飞霞佩，切云冠。漱冰濯雪，眇视万里一毫端。回首三山何处，闻道群仙笑我，要我欲俱还。挥手从此去，翳凤更骖鸾。|宋|水调歌头·金山观月
403|周邦彦|秋阴时晴渐向暝，变一庭凄冷。伫听寒声，云深无雁影。更深人去寂静，但照壁孤灯相映。酒已都醒，如何消夜永！|宋|关河令·秋阴时晴渐向暝
404|周紫芝|一点残红欲尽时。乍凉秋气满屏帏。梧桐叶上三更雨，叶叶声声是别离。调宝瑟，拨金猊。那时同唱鹧鸪词。如今风雨西楼夜，不听清歌也泪垂。|宋|鹧鸪天·一点残红欲尽时
405|姜夔|自作新词韵最娇，小红低唱我吹箫。曲终过尽松陵路，回首烟波十四桥。|宋|过垂虹
406|王世贞|昔闻李供奉，长啸独登楼。此地一垂顾，高名百代留。白云海色曙，明月天门秋。欲觅重来者，潺湲济水流。|明|登太白楼
407|严遂成|英雄立马起沙陀，奈此朱梁跋扈何。只手难扶唐社稷，连城犹拥晋山河。风云帐下奇儿在，鼓角灯前老泪多。萧瑟三垂冈下路，至今人唱《百年歌》。|清|三垂冈
408|左丘明|齐侯与蔡姬乘舟于囿，荡公。公惧变色；禁之，不可。公怒，归之，未之绝也。蔡人嫁之。四年春，齐侯以诸侯之师侵蔡，蔡溃，遂伐楚。楚子使与师言曰：“君处北海，寡人处南海，唯是风马牛不相及也。不虞君之涉吾地也，何故？”管仲对曰：“昔召康公命我先君太公曰：‘五侯九伯，女实征之，以夹辅周室。’赐我先君履：东至于海，西至于河，南至于穆陵，北至于无棣。尔贡包茅不入，王祭不共，无以缩酒，寡人是徵；昭王南征而不复，寡人是问。”对曰：“贡之不入，寡君之罪也，敢不共给？昭王之不复，君其问诸水滨。”师进，次于陉。夏，楚子使屈完如师。师退，次于召陵。齐侯陈诸侯之师，与屈完乘而观之。齐侯曰：“岂不榖()是为？先君之好是继，与不榖同好，何如？”对曰：“君惠徼福于敝邑之社稷，辱收寡君，寡君之愿也。”齐侯曰：“以此众战，谁能御之！以此攻城，何城不克！”对曰：“君若以德绥诸侯，谁敢不服？君若以力，楚国方城以为城，汉水以为池，虽众，无所用之！”屈完及诸侯盟。|先秦|齐桓公伐楚盟屈完
409|张志和|八月九月芦花飞，南谿老人重钓归。秋山入帘翠滴滴，野艇倚槛云依依。却把渔竿寻小径，闲梳鹤发对斜晖。翻嫌四皓曾多事，出为储皇定是非。|唐|渔父
410|马戴|金带连环束战袍，马头冲雪度临洮。卷旗夜劫单于帐，乱斫胡儿缺宝刀。|唐|出塞词
411|陈师道|岁晚身何托，灯前客未空。半生忧患里，一梦有无中。发短愁催白，颜衰酒借红。我歌君起舞，潦倒略相同。|宋|除夜对酒赠少章
412|周邦彦|秋阴时晴向暝。变一庭凄冷。伫听寒声，云深无雁影。更深人去寂静。但照壁、孤灯相映。酒已都醒，如何消夜永。|宋|关河令·秋阴时晴渐向暝
