|author|body|dynasty|name
0|马致远|枯藤老树昏鸦，小桥流水人家，古道西风瘦马。夕阳西下，断肠人在天涯。|元|天净沙·秋思
1|李白|故人西辞黄鹤楼，烟花三月下扬州。孤帆远影碧空尽，唯见长江天际流。|唐|黄鹤楼送孟浩然之广陵
2|李白|君不见，黄河之水天上来，奔流到海不复回。君不见，高堂明镜悲白发，朝如青丝暮成雪。人生得意须尽欢，莫使金樽空对月。天生我材必有用，千金散尽还复来。烹羊宰牛且为乐，会须一饮三百杯。岑夫子，丹丘生，将进酒，杯莫停。与君歌一曲，请君为我倾耳听。钟鼓馔玉不足贵，但愿长醉不复醒。古来圣贤皆寂寞，惟有饮者留其名。陈王昔时宴平乐，斗酒十千恣欢谑。主人何为言少钱，径须沽取对君酌。五花马，千金裘，呼儿将出换美酒，与尔同销万古愁。|唐|将进酒·君不见
3|王维|渭城朝雨浥轻尘，客舍青青柳色新。劝君更尽一杯酒，西出阳关无故人。|唐|渭城曲
4|佚名|唧唧复唧唧，木兰当户织。不闻机杼声，惟闻女叹息。问女何所思，问女何所忆。女亦无所思，女亦无所忆。昨夜见军帖，可汗大点兵，军书十二卷，卷卷有爷名。阿爷无大儿，木兰无长兄，愿为市鞍马，从此替爷征。东市买骏马，西市买鞍鞯，南市买辔头，北市买长鞭。旦辞爷娘去，暮宿黄河边，不闻爷娘唤女声，但闻黄河流水鸣溅溅。旦辞黄河去，暮至黑山头，不闻爷娘唤女声，但闻燕山胡骑鸣啾啾。万里赴戎机，关山度若飞。朔气传金柝，寒光照铁衣。将军百战死，壮士十年归。归来见天子，天子坐明堂。策勋十二转，赏赐百千强。可汗问所欲，木兰不用尚书郎，愿驰千里足，送儿还故乡。爷娘闻女来，出郭相扶将；阿姊闻妹来，当户理红妆；小弟闻姊来，磨刀霍霍向猪羊。开我东阁门，坐我西阁床，脱我战时袍，著我旧时裳。当窗理云鬓，对镜帖花黄。出门看火伴，火伴皆惊忙：同行十二年，不知木兰是女郎。雄兔脚扑朔，雌兔眼迷离；双兔傍地走，安能辨我是雄雌？|南北朝|木兰诗
5|杜甫|国破山河在，城春草木深。感时花溅泪，恨别鸟惊心。烽火连三月，家书抵万金。白头搔更短，浑欲不胜簪。|唐|春望
6|杜牧|清明时节雨纷纷，路上行人欲断魂。借问酒家何处有？牧童遥指杏花村。|唐|清明
7|辛弃疾|茅檐低小，溪上青青草。醉里吴音相媚好，白发谁家翁媪？大儿锄豆溪东，中儿正织鸡笼。最喜小儿亡赖，溪头卧剥莲蓬。|宋|清平乐·村居
8|王昌龄|寒雨连江夜入吴，平明送客楚山孤。洛阳亲友如相问，一片冰心在玉壶。|唐|芙蓉楼送辛渐
9|杨万里|毕竟西湖六月中，风光不与四时同。接天莲叶无穷碧，映日荷花别样红。|宋|晓出净慈寺送林子方
10|辛弃疾|明月别枝惊鹊，清风半夜鸣蝉。稻花香里说丰年，听取蛙声一片。七八个星天外，两三点雨山前。旧时茅店社林边，路转溪桥忽见。|宋|西江月·夜行黄沙道中
11|王之涣|白日依山尽，黄河入海流。欲穷千里目，更上一层楼。|唐|登鹳雀楼
12|王昌龄|秦时明月汉时关，万里长征人未还。但使龙城飞将在，不教胡马度阴山。|唐|出塞二首·其一
13|李白|李白乘舟将欲行，忽闻岸上踏歌声。桃花潭水深千尺，不及汪伦送我情。|唐|赠汪伦
14|苏轼|老夫聊发少年狂，左牵黄，右擎苍，锦帽貂裘，千骑卷平冈。为报倾城随太守，亲射虎，看孙郎。酒酣胸胆尚开张。鬓微霜，又何妨！持节云中，何日遣冯唐？会挽雕弓如满月，西北望，射天狼。|宋|江城子·密州出猎
15|王翰|葡萄美酒夜光杯，欲饮琵琶马上催。醉卧沙场君莫笑，古来征战几人回？|唐|凉州词二首·其一
16|王勃|城阙辅三秦，风烟望五津。与君离别意，同是宦游人。海内存知己，天涯若比邻。无为在歧路，儿女共沾巾。|唐|送杜少府之任蜀州
17|岑参|北风卷地白草折，胡天八月即飞雪。忽如一夜春风来，千树万树梨花开。散入珠帘湿罗幕，狐裘不暖锦衾薄。将军角弓不得控，都护铁衣冷难着。瀚海阑干百丈冰，愁云惨淡万里凝。中军置酒饮归客，胡琴琵琶与羌笛。纷纷暮雪下辕门，风掣红旗冻不翻。轮台东门送君去，去时雪满天山路。山回路转不见君，雪上空留马行处。|唐|白雪歌送武判官归京
18|陆游|莫笑农家腊酒浑，丰年留客足鸡豚。山重水复疑无路，柳暗花明又一村。箫鼓追随春社近，衣冠简朴古风存。从今若许闲乘月，拄杖无时夜叩门。|宋|游山西村
19|贾岛|松下问童子，言师采药去。只在此山中，云深不知处。|唐|寻隐者不遇
20|辛弃疾|醉里挑灯看剑，梦回吹角连营。八百里分麾下炙，五十弦翻塞外声，沙场秋点兵。马作的卢飞快，弓如霹雳弦惊。了却君王天下事，赢得生前身后名。可怜白发生！|宋|破阵子·为陈同甫赋壮词以寄之
21|孟浩然|故人具鸡黍，邀我至田家。绿树村边合，青山郭外斜。开轩面场圃，把酒话桑麻。待到重阳日，还来就菊花。|唐|过故人庄
22|白居易|离离原上草，一岁一枯荣。野火烧不尽，春风吹又生。远芳侵古道，晴翠接荒城。又送王孙去，萋萋满别情。|唐|草
23|王维|单车欲问边，属国过居延。征蓬出汉塞，归雁入胡天。大漠孤烟直，长河落日圆。萧关逢候骑，都护在燕然。|唐|使至塞上
24|柳永|寒蝉凄切，对长亭晚，骤雨初歇。都门帐饮无绪，留恋处，兰舟催发。执手相看泪眼，竟无语凝噎。念去去，千里烟波，暮霭沉沉楚天阔。多情自古伤离别，更那堪，冷落清秋节！今宵酒醒何处？杨柳岸，晓风残月。此去经年，应是良辰好景虚设。便纵有千种风情，更与何人说？|宋|雨霖铃
25|范仲淹|塞下秋来风景异，衡阳雁去无留意。四面边声连角起，千嶂里，长烟落日孤城闭。浊酒一杯家万里，燕然未勒归无计。羌管悠悠霜满地，人不寐，将军白发征夫泪。|宋|渔家傲·秋思
26|欧阳修|环滁皆山也。其西南诸峰，林壑尤美，望之蔚然而深秀者，琅琊也。山行六七里，渐闻水声潺潺而泻出于两峰之间者，酿泉也。峰回路转，有亭翼然临于泉上者，醉翁亭也。作亭者谁？山之僧智仙也。名之者谁？太守自谓也。太守与客来饮于此，饮少辄醉，而年又最高，故自号曰醉翁也。醉翁之意不在酒，在乎山水之间也。山水之乐，得之心而寓之酒也。若夫日出而林霏开，云归而岩穴暝，晦明变化者，山间之朝暮也。野芳发而幽香，佳木秀而繁阴，风霜高洁，水落而石出者，山间之四时也。朝而往，暮而归，四时之景不同，而乐亦无穷也。至于负者歌于途，行者休于树，前者呼，后者应，伛偻提携，往来而不绝者，滁人游也。临溪而渔，溪深而鱼肥。酿泉为酒，泉香而酒洌；山肴野蔌，杂然而前陈者，太守宴也。宴酣之乐，非丝非竹，射者中，弈者胜，觥筹交错，起坐而喧哗者，众宾欢也。苍颜白发，颓然乎其间者，太守醉也。已而夕阳在山，人影散乱，太守归而宾客从也。树林阴翳，鸣声上下，游人去而禽鸟乐也。然而禽鸟知山林之乐，而不知人之乐；人知从太守游而乐，而不知太守之乐其乐也。醉能同其乐，醒能述以文者，太守也。太守谓谁？庐陵欧阳修也。|宋|醉翁亭记
27|刘长卿|日暮苍山远，天寒白屋贫。柴门闻犬吠，风雪夜归人。|唐|逢雪宿芙蓉山主人
28|王之涣|黄河远上白云间，一片孤城万仞山。羌笛何须怨杨柳，春风不度玉门关。|唐|凉州词二首·其一
29|翁卷|绿遍山原白满川，子规声里雨如烟。乡村四月闲人少，才了蚕桑又插田。|宋|乡村四月
30|王安石|飞来山上千寻塔，闻说鸡鸣见日升。不畏浮云遮望眼，自缘身在最高层。|宋|登飞来峰
31|王羲之|永和九年，岁在癸丑，暮春之初，会于会稽山阴之兰亭，修禊事也。群贤毕至，少长咸集。此地有崇山峻岭，茂林修竹，又有清流激湍，映带左右，引以为流觞曲水，列坐其次。虽无丝竹管弦之盛，一觞一咏，亦足以畅叙幽情。是日也，天朗气清，惠风和畅。仰观宇宙之大，俯察品类之盛，所以游目骋怀，足以极视听之娱，信可乐也。夫人之相与，俯仰一世。或取诸怀抱，悟言一室之内；或因寄所托，放浪形骸之外。虽趣舍万殊，静躁不同，当其欣于所遇，暂得于己，快然自足，不知老之将至；及其所之既倦，情随事迁，感慨系之矣。向之所欣，俯仰之间，已为陈迹，犹不能不以之兴怀，况修短随化，终期于尽！古人云：“死生亦大矣。”岂不痛哉！每览昔人兴感之由，若合一契，未尝不临文嗟悼，不能喻之于怀。固知一死生为虚诞，齐彭殇为妄作。后之视今，亦犹今之视昔，悲夫！故列叙时人，录其所述，虽世殊事异，所以兴怀，其致一也。后之览者，亦将有感于斯文。|魏晋|兰亭集序
32|杨万里|篱落疏疏一径深，树头花落未成阴。儿童急走追黄蝶，飞入菜花无处寻。|宋|宿新市徐公店
33|李贺|黑云压城城欲摧，甲光向日金鳞开。角声满天秋色里，塞上燕脂凝夜紫。半卷红旗临易水，霜重鼓寒声不起。报君黄金台上意，提携玉龙为君死。|唐|雁门太守行
34|杜甫|风急天高猿啸哀，渚清沙白鸟飞回。无边落木萧萧下，不尽长江滚滚来。万里悲秋常作客，百年多病独登台。艰难苦恨繁霜鬓，潦倒新停浊酒杯。|唐|登高
35|李白|青山横北郭，白水绕东城。此地一为别，孤蓬万里征。浮云游子意，落日故人情。挥手自兹去，萧萧班马鸣。|唐|送友人
36|苏轼|壬戌之秋，七月既望，苏子与客泛舟游于赤壁之下。清风徐来，水波不兴。举酒属客，诵明月之诗，歌窈窕之章。少焉，月出于东山之上，徘徊于斗牛之间。白露横江，水光接天。纵一苇之所如，凌万顷之茫然。浩浩乎如冯虚御风，而不知其所止；飘飘乎如遗世独立，羽化而登仙。于是饮酒乐甚，扣舷而歌之。歌曰：“桂棹兮兰桨，击空明兮溯流光。渺渺兮予怀，望美人兮天一方。”客有吹洞箫者，倚歌而和之。其声呜呜然，如怨如慕，如泣如诉，余音袅袅，不绝如缕。舞幽壑之潜蛟，泣孤舟之嫠妇。苏子愀然，正襟危坐而问客曰：“何为其然也？”客曰：“月明星稀，乌鹊南飞，此非曹孟德之诗乎？西望夏口，东望武昌，山川相缪，郁乎苍苍，此非孟德之困于周郎者乎？方其破荆州，下江陵，顺流而东也，舳舻千里，旌旗蔽空，酾酒临江，横槊赋诗，固一世之雄也，而今安在哉？况吾与子渔樵于江渚之上，侣鱼虾而友麋鹿，驾一叶之扁舟，举匏樽以相属。寄蜉蝣于天地，渺沧海之一粟。哀吾生之须臾，羡长江之无穷。挟飞仙以遨游，抱明月而长终。知不可乎骤得，托遗响于悲风。”苏子曰：“客亦知夫水与月乎？逝者如斯，而未尝往也；盈虚者如彼，而卒莫消长也。盖将自其变者而观之，则天地曾不能以一瞬；自其不变者而观之，则物与我皆无尽也，而又何羡乎！且夫天地之间，物各有主，苟非吾之所有，虽一毫而莫取。惟江上之清风，与山间之明月，耳得之而为声，目遇之而成色，取之无禁，用之不竭，是造物者之无尽藏也，而吾与子之所共适。”客喜而笑，洗盏更酌。肴核既尽，杯盘狼藉。相与枕藉乎舟中，不知东方之既白。|宋|前赤壁赋
37|陶渊明|种豆南山下，草盛豆苗稀。晨兴理荒秽，带月荷锄归。道狭草木长，夕露沾我衣。衣沾不足惜，但使愿无违。|魏晋|归园田居·其三
38|刘禹锡|九曲黄河万里沙，浪淘风簸自天涯。如今直上银河去，同到牵牛织女家。|唐|浪淘沙·九曲黄河万里沙
39|胡令能|蓬头稚子学垂纶，侧坐莓苔草映身。路人借问遥招手，怕得鱼惊不应人。|唐|小儿垂钓
40|高鼎|草长莺飞二月天，拂堤杨柳醉春烟。儿童散学归来早，忙趁东风放纸鸢。|清|村居
41|李煜|无言独上西楼，月如钩。寂寞梧桐深院锁清秋。剪不断，理还乱，是离愁，别是一般滋味在心头。|五代|相见欢（无言独上西楼）
42|李白|花间一壶酒，独酌无相亲。举杯邀明月，对影成三人。月既不解饮，影徒随我身。暂伴月将影，行乐须及春。我歌月徘徊，我舞影零乱。醒时相交欢，醉后各分散。永结无情游，相期邈云汉。|唐|月下独酌四首·其一
43|李白|金樽清酒斗十千，玉盘珍羞直万钱。停杯投箸不能食，拔剑四顾心茫然。欲渡黄河冰塞川，将登太行雪满山。闲来垂钓碧溪上，忽复乘舟梦日边。行路难！行路难！多歧路，今安在？长风破浪会有时，直挂云帆济沧海。|唐|行路难·其一
44|杜甫|戍鼓断人行，秋边一雁声。露从今夜白，月是故乡明。有弟皆分散，无家问死生。寄书长不达，况乃未休兵。|唐|月夜忆舍弟
45|王昌龄|青海长云暗雪山，孤城遥望玉门关。黄沙百战穿金甲，不破楼兰终不还。|唐|从军行七首·其四
46|范成大|梅子金黄杏子肥，麦花雪白菜花稀。日长篱落无人过，惟有蜻蜓蛱蝶飞。|宋|四时田园杂兴·其二
47|刘方平|更深月色半人家，北斗阑干南斗斜。今夜偏知春气暖，虫声新透绿窗纱。|唐|月夜
48|白居易| 绿蚁新醅酒，红泥小火炉。晚来天欲雪，能饮一杯无？|唐|问刘十九
49|王观|水是眼波横，山是眉峰聚。欲问行人去那边？眉眼盈盈处。才始送春归，又送君归去。若到江南赶上春，千万和春住。|宋|卜算子·送鲍浩然之浙东
50|杜牧|折戟沉沙铁未销，自将磨洗认前朝。东风不与周郎便，铜雀春深锁二乔。|唐|赤壁
51|李白|渡远荆门外，来从楚国游。山随平野尽，江入大荒流。月下飞天镜，云生结海楼。仍怜故乡水，万里送行舟。|唐|渡荆门送别
52|岑参|故园东望路漫漫，双袖龙钟泪不干。马上相逢无纸笔，凭君传语报平安。|唐|逢入京使
53|卢纶|月黑雁飞高，单于夜遁逃。欲将轻骑逐，大雪满弓刀。|唐|和张仆射塞下曲·其三
54|王维|山中相送罢，日暮掩柴扉。春草明年绿，王孙归不归。|唐|送别
55|杨万里|一叶渔船两小童，收篙停棹坐船中。怪生无雨都张伞，不是遮头是使风。|宋|舟过安仁
56|志南|古木阴中系短篷，杖藜扶我过桥东。沾衣欲湿杏花雨，吹面不寒杨柳风。|宋|绝句·古木阴中系短篷
57|王维|中岁颇好道，晚家南山陲。兴来每独往，胜事空自知。行到水穷处，坐看云起时。偶然值林叟，谈笑无还期。|唐|终南别业
58|李贺|大漠沙如雪，燕山月似钩。何当金络脑，快走踏清秋。|唐|马诗二十三首·其五
59|刘长卿|苍苍竹林寺，杳杳钟声晚。荷笠带斜阳，青山独归远。|唐|送灵澈上人
60|陶渊明|余家贫，耕植不足以自给。幼稚盈室，瓶无储粟，生生所资，未见其术。亲故多劝余为长吏，脱然有怀，求之靡途。会有四方之事，诸侯以惠爱为德，家叔以余贫苦，遂见用于小邑。于时风波未静，心惮远役，彭泽去家百里，公田之利，足以为酒。故便求之。及少日，眷然有归欤之情。何则？质性自然，非矫厉所得。饥冻虽切，违己交病。尝从人事，皆口腹自役。于是怅然慷慨，深愧平生之志。犹望一稔，当敛裳宵逝。寻程氏妹丧于武昌，情在骏奔，自免去职。仲秋至冬，在官八十余日。因事顺心，命篇曰《归去来兮》。乙巳岁十一月也。归去来兮，田园将芜胡不归？既自以心为形役，奚惆怅而独悲？悟已往之不谏，知来者之可追。实迷途其未远，觉今是而昨非。舟遥遥以轻飏，风飘飘而吹衣。问征夫以前路，恨晨光之熹微。乃瞻衡宇，载欣载奔。僮仆欢迎，稚子候门。三径就荒，松菊犹存。携幼入室，有酒盈樽。引壶觞以自酌，眄庭柯以怡颜。倚南窗以寄傲，审容膝之易安。园日涉以成趣，门虽设而常关。策扶老以流憩，时矫首而遐观。云无心以出岫，鸟倦飞而知还。景翳翳以将入，抚孤松而盘桓。归去来兮，请息交以绝游。世与我而相违，复驾言兮焉求？悦亲戚之情话，乐琴书以消忧。农人告余以春及，将有事于西畴。或命巾车，或棹孤舟。既窈窕以寻壑，亦崎岖而经丘。木欣欣以向荣，泉涓涓而始流。善万物之得时，感吾生之行休。已矣乎！寓形宇内复几时？曷不委心任去留？胡为乎遑遑欲何之？富贵非吾愿，帝乡不可期。怀良辰以孤往，或植杖而耘耔。登东皋以舒啸，临清流而赋诗。聊乘化以归尽，乐夫天命复奚疑！|魏晋|归去来兮辞·并序
61|范成大|昼出耘田夜绩麻，村庄儿女各当家。童孙未解供耕织，也傍桑阴学种瓜。|宋|夏日田园杂兴·其七
62|佚名|采薇采薇，薇亦作止。曰归曰归，岁亦莫止。靡室靡家，玁狁之故。不遑启居，玁狁之故。采薇采薇，薇亦柔止。曰归曰归，心亦忧止。忧心烈烈，载饥载渴。我戍未定，靡使归聘。采薇采薇，薇亦刚止。曰归曰归，岁亦阳止。王事靡盬，不遑启处。忧心孔疚，我行不来。彼尔维何？维常之华。彼路斯何？君子之车。戎车既驾，四牡业业。岂敢定居？一月三捷。驾彼四牡，四牡骙骙。君子所依，小人所腓。四牡翼翼，象弭鱼服。岂不日戒，玁狁孔棘。昔我往矣，杨柳依依。今我来思，雨雪霏霏。行道迟迟，载渴载饥。我心伤悲，莫知我哀！|先秦|采薇
63|吴均|山际见来烟，竹中窥落日。鸟向檐上飞，云从窗里出。|南北朝|山中杂诗
64|杜甫|暮投石壕村，有吏夜捉人。老翁逾墙走，老妇出门看。吏呼一何怒！妇啼一何苦！听妇前致词：三男邺城戍。一男附书至，二男新战死。存者且偷生，死者长已矣！室中更无人，惟有乳下孙。有孙母未去，出入无完裙。老妪力虽衰，请从吏夜归，急应河阳役，犹得备晨炊。夜久语声绝，如闻泣幽咽。天明登前途，独与老翁别。|唐|石壕吏
65|王维|木末芙蓉花，山中发红萼。涧户寂无人，纷纷开且落。|唐|辛夷坞
66|宋之问|岭外音书断，经冬复历春。近乡情更怯，不敢问来人。|唐|渡汉江
67|杨万里|莫言下岭便无难，赚得行人空喜欢。正入万山圈子里，一山放过一山拦。|宋|过松源晨炊漆公店
68|李白|兰陵美酒郁金香，玉碗盛来琥珀光。但使主人能醉客，不知何处是他乡。|唐|客中行
69|李商隐|昨夜星辰昨夜风，画楼西畔桂堂东。身无彩凤双飞翼，心有灵犀一点通。隔座送钩春酒暖，分曹射覆蜡灯红。嗟余听鼓应官去，走马兰台类转蓬。|唐|无题·昨夜星辰昨夜风
70|李白|明月出天山，苍茫云海间。长风几万里，吹度玉门关。汉下白登道，胡窥青海湾。由来征战地，不见有人还。戍客望边色，思归多苦颜。高楼当此夜，叹息未应闲。|唐|关山月
71|佚名|呦呦鹿鸣，食野之苹。我有嘉宾，鼓瑟吹笙。吹笙鼓簧，承筐是将。人之好我，示我周行。呦呦鹿鸣，食野之蒿。我有嘉宾，德音孔昭。视民不恌，君子是则是效。我有旨酒，嘉宾式燕以敖。呦呦鹿鸣，食野之芩。我有嘉宾，鼓瑟鼓琴。鼓瑟鼓琴，和乐且湛。我有旨酒，以燕乐嘉宾之心。|先秦|小雅·鹿鸣
72|李白|弃我去者，昨日之日不可留；乱我心者，今日之日多烦忧。长风万里送秋雁，对此可以酣高楼。蓬莱文章建安骨，中间小谢又清发。俱怀逸兴壮思飞，欲上青天览明月。抽刀断水水更流，举杯消愁愁更愁。人生在世不称意，明朝散发弄扁舟。|唐|宣州谢朓楼饯别校书叔云
73|佚名|杨柳青青著地垂，杨花漫漫搅天飞。柳条折尽花飞尽，借问行人归不归？|隋|送别诗
74|佚名|迢迢牵牛星，皎皎河汉女。纤纤擢素手，札札弄机杼。终日不成章，泣涕零如雨；河汉清且浅，相去复几许！盈盈一水间，脉脉不得语。|汉|迢迢牵牛星
75|冯延巳|春日宴，绿酒一杯歌一遍。再拜陈三愿：一愿郎君千岁，二愿妾身常健，三愿如同梁上燕，岁岁长相见。|五代|长命女·春日宴
76|纳兰性德|山一程，水一程，身向榆关那畔行，夜深千帐灯。风一更，雪一更，聒碎乡心梦不成，故园无此声。|清|长相思·山一程
77|陶渊明|少无适俗韵，性本爱丘山。误落尘网中，一去三十年。羁鸟恋旧林，池鱼思故渊。开荒南野际，守拙归园田。方宅十余亩，草屋八九间。榆柳荫后檐，桃李罗堂前。暧暧远人村，依依墟里烟。狗吠深巷中，鸡鸣桑树颠。户庭无尘杂，虚室有余闲。久在樊笼里，复得返自然。|魏晋|归园田居(其一)
78|王建|雨里鸡鸣一两家，竹溪村路板桥斜。妇姑相唤浴蚕去，闲看中庭栀子花。|唐|雨过山村
79|李白|夫天地者，万物之逆旅也；光阴者，百代之过客也。而浮生若梦，为欢几何？古人秉烛夜游，良有以也。况阳春召我以烟景，大块假我以文章。会桃花之芳园，序天伦之乐事。群季俊秀，皆为惠连；吾人咏歌，独惭康乐。幽赏未已，高谈转清。开琼筵以坐花，飞羽觞而醉月。不有佳咏，何伸雅怀？如诗不成，罚依金谷酒数。|唐|春夜宴桃李园序
80|李白|百战沙场碎铁衣，城南已合数重围。突营射杀呼延将，独领残兵千骑归。|唐|从军行·其二
81|佚名|行行重行行，与君生别离。相去万余里，各在天一涯。道路阻且长，会面安可知。胡马依北风，越鸟巢南枝。相去日已远，衣带日已缓。浮云蔽白日，游子不顾反。思君令人老，岁月忽已晚。弃捐勿复道，努力加餐饭。|汉|行行重行行
82|岑参|君不见走马川行雪海边，平沙莽莽黄入天。轮台九月风夜吼，一川碎石大如斗，随风满地石乱走。匈奴草黄马正肥，金山西见烟尘飞，汉家大将西出师。将军金甲夜不脱，半夜军行戈相拨，风头如刀面如割。马毛带雪汗气蒸，五花连钱旋作冰，幕中草檄砚水凝。虏骑闻之应胆慑，料知短兵不敢接，车师西门伫献捷。|唐|走马川行奉送出师西征
83|宋濂|余幼时即嗜学。家贫，无从致书以观，每假借于藏书之家，手自笔录，计日以还。天大寒，砚冰坚，手指不可屈伸，弗之怠。录毕，走送之，不敢稍逾约。以是人多以书假余，余因得遍观群书。既加冠，益慕圣贤之道，又患无硕师、名人与游，尝趋百里外，从乡之先达执经叩问。先达德隆望尊，门人弟子填其室，未尝稍降辞色。余立侍左右，援疑质理，俯身倾耳以请；或遇其叱咄，色愈恭，礼愈至，不敢出一言以复；俟其欣悦，则又请焉。故余虽愚，卒获有所闻。当余之从师也，负箧曳屣，行深山巨谷中，穷冬烈风，大雪深数尺，足肤皲裂而不知。至舍，四支僵劲不能动，媵人持汤沃灌，以衾拥覆，久而乃和。寓逆旅，主人日再食，无鲜肥滋味之享。同舍生皆被绮绣，戴珠缨宝饰之帽，腰白玉之环，左佩刀，右备容臭，烨然若神人；余则缊袍敝衣处其间，略无慕艳意，以中有足乐者，不知口体之奉不若人也。盖余之勤且艰若此。|明|送东阳马生序(节选)
84|雷震|草满池塘水满陂，山衔落日浸寒漪。牧童归去横牛背，短笛无腔信口吹。|宋|村晚
85|李白|炉火照天地，红星乱紫烟。赧郎明月夜，歌曲动寒川。|唐|秋浦歌十七首·其十四
86|宋祁|东城渐觉风光好。縠皱波纹迎客棹。绿杨烟外晓寒轻，红杏枝头春意闹。浮生长恨欢娱少。肯爱千金轻一笑。为君持酒劝斜阳，且向花间留晚照。|宋|玉楼春·春景
87|佚名|击鼓其镗，踊跃用兵。土国城漕，我独南行。从孙子仲，平陈与宋。不我以归，忧心有忡。爰居爰处？爰丧其马？于以求之？于林之下。死生契阔，与子成说。执子之手，与子偕老。于嗟阔兮，不我活兮。于嗟洵兮，不我信兮。|先秦|击鼓
88|李益|回乐峰前沙似雪，受降城外月如霜。不知何处吹芦管，一夜征人尽望乡。|唐|夜上受降城闻笛
89|戴叔伦|边草，边草，边草尽来兵老。山南山北雪晴，千里万里月明。明月，明月，胡笳一声愁绝。|唐|调笑令·边草
