|author|body|dynasty|name
505|白居易|柳湖松岛莲花寺，晚动归桡出道场。卢橘子低山雨重，棕榈叶战水风凉。烟波澹荡摇空碧，楼殿参差倚夕阳。到岸请君回首望，蓬莱宫在海中央。|唐|西湖晚归回望孤山寺赠诸客
506|何景明|十二峰头秋草荒，冷烟寒月过瞿塘。青枫江上孤舟客，不听猿啼亦断肠。|明|竹枝词·十二峰头秋草荒
507|吴文英|山远翠眉长。高处凄凉。菊花清瘦杜秋娘。净洗绿杯牵露井，聊荐幽香。乌帽压吴霜。风力偏狂。一年佳节过西厢。秋色雁声愁几许，都在斜阳。|宋|浪淘沙·九日从吴见山觅酒
508|权德舆|扣船不得寐，浩露清衣襟。弥伤孤舟夜，远结万里心。幽兴惜瑶草，素怀寄鸣琴。三奏月初上，寂寞寒江深。|唐|月夜江行
509|岑参|九日黄花酒，登高会昔闻。霜威逐亚相，杀气傍中军。横笛惊征雁，娇歌落塞云。边头幸无事，醉舞荷吾君。|唐|奉陪封大夫九日登高
510|朱敦儒|摇首出红尘，醒醉更无时节。活计绿蓑青笠，惯披霜冲雪。晚来风定钓丝闲，上下是新月。千里水天一色，看孤鸿明灭。|宋|好事近·摇首出红尘
511|辛弃疾|王漕饯别。司马赋水调歌头，席间次韵。时王公明枢密薨，坐客终夕为兴门户之叹，故前章及之我饮不须劝，正怕酒尊空。别离亦复何恨，此别恨匆匆。间上貂蝉贵客，花外麒麟高冢，人世竟谁雄。一笑出门去，千里落花风。孙刘辈，能使我，不为公。余发种种如是，此事付渠侬。但觉平生湖海，除了醉吟风月，此外百无功。毫发皆帝力，更乞鉴湖东。|宋|水调歌头·我饮不须劝
512|梅尧臣|春云浓淡日微光，双阙重门耸建章。不上楼来知几日，满城无算柳梢黄。|宋|考试毕登铨楼
513|佚名|幡幡瓠叶，采之亨之。君子有酒，酌言尝之。有兔斯首，炮之燔之。君子有酒，酌言献之。有兔斯首，燔之炙之。君子有酒，酌言酢之。有兔斯首，燔之炮之。君子有酒，酌言酬之。|先秦|瓠叶
514|白居易|独凭朱槛立凌晨，山色初明水色新。竹雾晓笼衔岭月，蘋风暖送过江春。子城阴处犹残雪，衙鼓声前未有尘。三百年来庾楼上，曾经多少望乡人。|唐|庾楼晓望
515|佚名|楚楚者茨，言抽其棘。自昔何为，我艺黍稷。我黍与与，我稷翼翼。我仓既盈，我庾维亿。以为酒食，以享以祀。以妥以侑，以介景福。济济跄跄，絜尔牛羊，以往烝尝。或剥或亨，或肆或将。祝祭于祊，祀事孔明。先祖是皇，神保是飨。孝孙有庆，报以介福，万寿无疆。执爨踖踖，为俎孔硕。或燔或炙，君妇莫莫。为豆孔庶，为宾为客。献酬交错，礼仪卒度，笑语卒获。神保是格，报以介福，万寿攸酢。我孔戁矣，式礼莫愆。工祝致告，徂赉孝孙。苾芬孝祀，神嗜饮食。卜尔百福，如几如式。既齐既稷，既匡既敕。永锡尔极，时万时亿。礼仪既备，钟鼓既戒。孝孙徂位，工祝致告。神具醉止，皇尸载起。钟鼓送尸，神保聿归。诸宰君妇，废彻不迟。诸父兄弟，备言燕私。乐具入奏，以绥后禄。尔肴既将，莫怨具庆。既醉既饱，小大稽首。神嗜饮食，使君寿考。孔惠孔时，维其尽之。子子孙孙，勿替引之。|先秦|楚茨
516|朱栴|塞下景荒凉，淡薄秋光，金风淅淅透衣裳。读罢安仁《秋兴赋》，憀栗悲伤。廿载住边疆，两鬓成霜，天边鸿雁又南翔。借问夏城屯戍客，是否思乡？|明|浪淘沙·秋
517|高启|满衣血泪与尘埃，乱后还乡亦可哀。风雨梨花寒食过，几家坟上子孙来？|明|送陈秀才还沙上省墓
518|朱淑真|风光紧急。三月俄三十。拟欲留连计无及。绿野烟愁露泣。倩谁寄语春宵。城头画鼓轻敲。缱绻临歧嘱付，来年早到梅梢。|宋|清平乐·风光紧急
519|李贺|秋风吹地百草干，华容碧影生晚寒。我当二十不得意，一心愁谢如枯兰。衣如飞鹑马如狗，临歧击剑生铜吼。旗亭下马解秋衣，请贳宜阳一壶酒。壶中唤天云不开，白昼万里闲凄迷。主人劝我养心骨，莫受俗物相填豗。|唐|开愁歌
520|叶梦得|落花已作风前舞。又送黄昏雨。晓来庭院半残红。惟有游丝千丈、罥晴空。殷勤花下同携手。更尽杯中酒。美人不用敛蛾眉。我亦多情无奈、酒阑时。|宋|虞美人·雨后同干誉才卿置酒来禽花下作
521|洪茶|断虹远饮横江水。万山紫翠斜阳里。紧马短亭西。丹枫明酒旗。浮生长客路。事逐孤鸿去。又是月黄昏。寒灯人闭门。|宋|菩萨蛮·宿水口
522|戎昱|汉将归来虏塞空，旌旗初下玉关东。高蹄战马三千匹，落日平原秋草中。|唐|塞下曲
523|李贺|胡角引北风，蓟门白于水。天含青海道，城头月千里。露下旗濛濛，寒金鸣夜刻。蕃甲锁蛇鳞，马嘶青冢白。秋静见旄头，沙远席羁愁。帐北天应尽，河声出塞流。|唐|塞下曲
524|王褒|秋风吹木叶，还似洞庭波。常山临代郡，亭障绕黄河。心悲异方乐，肠断陇头歌。薄暮临征马，失道北山阿。|南北朝|渡河北
525|卢纶|行多有病住无粮，万里还乡未到乡。蓬鬓哀吟长城下，不堪秋气入金疮。|唐|逢病军人
526|纳兰性德|人生何如不相识，君老江南我燕北。何如相逢不相合，更无别恨横胸臆。留君不住我心苦，横门骊歌泪如雨。君行四月草萋萋，柳花桃花半委泥。江流浩淼江月堕，此时君亦应思我。我今落拓何所止，一事无成已如此。平生纵有英雄血，无由一溅荆江水。荆江日落阵云低，横戈跃马今何时。忽忆去年风月夜，与君展卷论王霸。君今偃仰九龙间，吾欲从兹事耕稼。芙蓉湖上芙蓉花，秋风未落如朝霞。君如载酒需尽醉，醉来不复思天涯。|清|送荪友
527|范成大|杞菊垂珠滴露红，两蛩相应语莎丛。虫丝罥尽黄葵叶，寂历高花侧晚风。朱门巧夕沸欢声，田舍黄昏静掩扃。男解牵牛女能织，不须徼福渡河星。橘蠹如蚕入化机，枝间垂茧似蓑衣；忽然蜕作多花蝶，翅粉才乾便学飞。静看檐蛛结网低，无端妨碍小虫飞。蜻蜒倒挂蜂儿窘，催唤山童为解围。垂成穑事苦艰难，忌雨嫌风更怯寒。牋诉天公休掠剩，半赏私债半输官。秋来只怕雨垂垂，甲子无云万事宜。获稻毕工随晒谷，直须晴到入仓时。中秋全景属潜夫，棹入空明看太湖。身外水天银一色，城中有此月明无。新筑场泥镜面平，家家打稻趁霜晴；笑歌声里轻雷动，一夜连枷响到明。租船满载候开仓，粒粒如珠白似霜。不惜两钟输一斛，尚赢糠核饱儿郎。菽粟瓶罂贮满家，天教将醉作生涯。不知新滴堪篘未？细捣枨虀买鱠鱼，细捣枨虀卖脍鱼，西风吹上四腮鲈。雪松酥腻千丝缕，除却松江到处无。新霜彻晓报秋深，染尽青林作缬林。惟有橘园风景异，碧丛丛里万黄金。|宋|秋日田园杂兴
528|王维|天官动将星，汉上柳条青。万里鸣刁斗，三军出井陉。忘身辞凤阙，报国取龙庭。岂学书生辈，窗间老一经。|唐|送赵都督赴代州得青字
529|柳永|冻云黯淡天气，扁舟一叶，乘兴离江渚。渡万壑千岩，越溪深处。怒涛渐息，樵风乍起，更闻商旅相呼。片帆高举。泛画鹢、翩翩过南浦。望中酒旆闪闪，一簇烟村，数行霜树。残日下，渔人鸣榔归去。败荷零落，衰杨掩映，岸边两两三三，浣沙游女。避行客、含羞笑相语。到此因念，绣阁轻抛，浪萍难驻。叹后约丁宁竟何据。惨离怀，空恨岁晚归期阻。凝泪眼、杳杳神京路。断鸿声远长天暮。|宋|夜半乐·冻云黯淡天气
530|李纲|江上雪，独立钓渔翁。箬笠但闻冰散响，蓑衣时振玉花空。图画若为工。云水暮，归去远烟中。茅舍竹篱依小屿，缩鳊圆鲫入轻笼。欢笑有儿童。|宋|望江南·江上雪
531|苏轼|翠蛾羞黛怯人看。掩霜纨，泪偷弹。且尽一尊，收泪唱《阳关》。漫道帝城天样远，天易见，见君难。画堂新构近孤山。曲栏干，为谁安？飞絮落花，春色属明年。欲棹小舟寻旧事，无处问，水连天。|宋|江城子·孤山竹阁送述古
532|吴文英|门隔花深梦旧游。夕阳无语燕归愁。玉纤香动小帘钩。落絮无声春堕泪，行云有影月含羞。东风临夜冷于秋。|宋|浣溪沙·门隔花深梦旧游
533|吴文英|五更枥马静无声。邻鸡犹怕惊。日华平晓弄春明。暮寒愁翳生。新岁梦，去年情。残宵半酒醒。春风无定落梅轻。断鸿长短亭。|宋|醉桃源·元日
534|周邦彦|河桥送人处，凉夜何其。斜月远堕余辉。铜盘烛泪已流尽，霏霏凉露沾衣。相将散离会，探风前津鼓，树杪参旗。华骢会意，纵扬鞭、亦自行迟。迢递路回清野，人语渐无闻，空带愁归。何意重红满地，遗钿不见，斜迳都迷。兔葵燕麦，向残阳、欲与人齐。但徘徊班草，欷歔酹酒，极望天西。|宋|夜飞鹊·河桥送人处
535|张元干|曳杖危楼去。斗垂天、沧波万顷，月流烟渚。扫尽浮云风不定，未放扁舟夜渡。宿雁落、寒芦深处。怅望关河空吊影，正人间、鼻息鸣鼍鼓。谁伴我，醉中舞。十年一梦扬州路。倚高寒、愁生故国，气吞骄虏。要斩楼兰三尺剑，遗恨琵琶旧语。谩暗涩铜华尘土。唤取谪仙平章看，过苕溪、尚许垂纶否。风浩荡，欲飞举。|宋|贺新郎·寄李伯纪丞相
536|佚名|敦彼行苇，牛羊勿践履。方苞方体，维叶泥泥。戚戚兄弟，莫远具尔。或肆之筵，或授之几。肆筵设席，授几有缉御。或献或酢，洗爵奠斝。醓醢以荐，或燔或炙。嘉肴脾臄，或歌或咢。敦弓既坚，四鍭既钧，舍矢既均，序宾以贤。敦弓既句，既挟四鍭。四鍭如树，序宾以不侮。曾孙维主，酒醴维醹，酌以大斗，以祈黄耇。黄耇台背，以引以翼。寿考维祺，以介景福。|先秦|行苇
537|薛昭蕴|清明节，雨晴天，得意正当年。马骄泥软锦连乾，香袖半笼鞭。花色融，人竟赏，尽是绣鞍朱鞅。日斜无计更留连，归路草和烟。|唐|喜迁莺·清明节
538|詹玉|扫西风门径，黄叶凋零，白云萧散。柳换枯阴，赋归来何晚。爽气霏霏，翠蛾眉妩，聊慰登临眼。故国如尘，故人如梦，登高还懒。数点寒英，为谁零落，楚魄难招，暮寒堪揽。步屟荒篱，谁念幽芳远。一室秋灯，一庭秋雨，更一声秋雁。试引芳樽，不知消得，和多依黯。|宋|醉蓬莱·归故山
539|许浑|玉树歌残王气终，景阳兵合戍楼空。松楸远近千官冢，禾黍高低六代宫。石燕拂云晴亦雨，江豚吹浪夜还风。英雄一去豪华尽，惟有青山似洛中。|唐|金陵怀古
540|佚名|有頍者弁，实维伊何？尔酒既旨，尔肴既嘉。岂伊异人？兄弟匪他。茑与女萝，施于松柏。未见君子，忧心奕奕；既见君子，庶几说怿。有頍者弁，实维何期？尔酒既旨，尔肴既时。岂伊异人？兄弟具来。茑与女萝，施于松上。未见君子，忧心怲々；既见君子，庶几有臧。有頍者弁，实维在首。尔酒既旨，尔肴既阜。岂伊异人？兄弟甥舅。如彼雨雪，先集维霰。死丧无日，无几相见。乐酒今夕，君子维宴。|先秦|頍弁
541|李梦阳|黄河水绕汉宫墙，河上秋风雁几行。客子过壕追野马，将军韬箭射天狼。黄尘古渡迷飞挽，白月横空冷战场。闻道朔方多勇略，只今谁是郭汾阳。|明|秋望
542|叶梦得|秋色渐将晚，霜信报黄花。小窗低户深映，微路绕欹斜。为问山翁何事，坐看流年轻度，拚却鬓双华。徙倚望沧海，天净水明霞。念平昔，空飘荡，遍天涯。归来三径重扫，松竹本吾家。却恨悲风时起，冉冉云间新雁，边马怨胡笳。谁似东山老，谈笑静胡沙。|宋|水调歌头·秋色渐将晚
543|程垓|独自上层楼，楼外青山远。望以斜阳欲尽时，不见西飞雁。独自下层楼，楼下蛩声怨。待到黄昏月上时，依旧柔肠断。|宋|卜算子·独自上层楼
544|韩琦|池馆隳摧古榭荒，此延嘉客会重阳。虽惭老圃秋容淡，且看黄花晚节香。酒味已醇新过熟，蟹螯先实不须霜。年来饮兴衰难强，漫有高吟力尚狂。|宋|九日水阁
545|姚云文|近重阳、偏多风雨，绝怜此日暄明。问秋香浓未，待携客、出西城。正自羁怀多感，怕荒台高处，更不胜情。向尊前、又忆漉酒插花人。只座上、已无老兵。凄情。浅醉还醒。愁不肯、与诗平。记长楸走马，雕弓{扌笮}柳，前事休评。紫萸一枝传赐，梦谁到、汉家陵。尽乌纱、便随风去，要天知道，华发如此星星。歌罢涕零。|宋|紫萸香慢·近重阳
546|欧阳修|花底忽闻敲两桨。逡巡女伴来寻访。酒盏旋将荷叶当。莲舟荡。时时盏里生红浪。花气酒香清厮酿。花腮酒面红相向。醉倚绿阴眠一饷。惊起望。船头阁在沙滩上。|宋|渔家傲·花底忽闻敲两桨
547|晏几道|南苑吹花，西楼题叶，故园欢事重重。凭阑秋思，闲记旧相逢。几处歌云梦雨，可怜便、汉水西东。别来久，浅情未有，锦字系征鸿。年光还少味，开残槛菊，落尽溪桐。漫留得，尊前淡月西风。此恨谁堪共说，清愁付、绿酒杯中。佳期在，归时待把，香袖看啼红。|宋|满庭芳·南苑吹花
548|王昌龄|秋风夜渡河，吹却雁门桑。遥见胡地猎，鞴马宿严霜。五道分兵去，孤军百战场。功多翻下狱，士卒但心伤。|唐|塞下曲·秋风夜渡河
549|佚名|五两竿头风欲平，长风举棹觉船轻。柔橹不施停却棹，是船行。满眼风波多闪烁，看山恰似走来迎。仔细看山山不动，是船行。|五代|浣溪沙·五两竿头风欲平
550|佚名|叔于田，巷无居人。岂无居人？不如叔也。洵美且仁。叔于狩，巷无饮酒。岂无饮酒？不如叔也。洵美且好。叔适野，巷无服马。岂无服马？不如叔也。洵美且武。|先秦|叔于田
551|宋江|喜遇重阳，更佳酿今朝新熟。见碧水丹山，黄芦苦竹。头上尽教添白发，鬓边不可无黄菊。愿樽前长叙弟兄情，如金玉。统豺虎，御边幅，号令明，军威肃。中心愿，平虏保民安国。日月常悬忠烈胆，风尘障却奸邪目。望天王降诏，早招安，心方足。|宋|满江红·喜遇重阳
552|卢纶|野幕敞琼筵，羌戎贺劳旋。醉和金甲舞，雷鼓动山川。|唐|和张仆射塞下曲·其四
553|张元干|春水迷天，桃花浪、几番风恶。云乍起、远山遮尽，晚风还作。绿卷芳洲生杜若。数帆带雨烟中落。傍向来、沙觜共停桡，伤飘泊。寒犹在，衾偏薄。肠欲断，愁难著。倚篷窗无寐，引杯孤酌。寒食清明都过却。最怜轻负年时约。想小楼、终日望归舟，人如削。|宋|满江红·自豫章阻风吴城山作
554|张养浩|一轮飞镜谁磨？照彻乾坤，印透山河。玉露泠泠，洗秋空银汉无波，比常夜清光更多，尽无碍桂影婆娑。老子高歌，为问嫦娥，良夜恹恹，不醉如何？|元|折桂令·中秋
555|张养浩|往常时为功名惹是非，如今对山水忘名利；往常时趁鸡声赴早朝，如今近晌午犹然睡。往常时秉笏立丹墀，如今把菊向东离；往常时俯仰承极贵，如今逍遥谒故知；往常时狂痴，险犯着笞杖徒流罪；如今便宜，课会风花雪月题。云来山更佳，云去山如画。山因云晦明，云共山高下。倚仗立云沙，回首见山家，野鹿眠山草，山猿戏野花。云霞，我爱山无价。看时行踏，云山也爱咱。抖擞了元亮尘，分付了苏卿印；喜西风范蠡舟，任雪满潘安鬓。乞得自由身，且作太平民；酒吸华峰月，吟泺水春。而今，识破东华梦；红裙，休歌南浦云。三十年一梦惊，财与气消磨尽。把当年花月心，都变做了今日山林兴。早是不能行，那更鬓星星。镜里常嗟叹，人前强打撑。歌声，积渐的无心听；多情，你频来待怎生？自高悬神武冠，身无事心无患。对风花雪月吟，有笔砚琴书伴。梦境儿也清安，俗势利不相关，由他傀儡棚头闹，且向昆仑顶上看。云山，隔断红尘岸；游观，壶中天地宽。也不学严子陵七里滩，也不学姜太公磻溪岸，也不学贺知章乞监湖，也不学柳子厚游南间。俺住云水屋三间，风月竹千竿。一任傀儡棚中闹，且向昆仑顶上看。身安，倒大来无忧患；游观，壶中天地宽。|元|雁儿落兼得胜令
556|刘长卿|晴川落日初低，惆怅孤舟解携。鸟向平芜远近，人随流水东西。白云千里万里，明月前溪后溪。独恨长沙谪去，江潭春草萋萋。|唐|谪仙怨·晴川落日初低
557|张孝祥|霜日明霄水蘸空。鸣鞘声里绣旗红。淡烟衰草有无中。万里中原烽火北，一尊浊酒戍楼东。酒阑挥泪向悲风。|宋|浣溪沙·霜日明霄水蘸空
558|华清淑|燕塞雪，片片大如拳。蓟上酒楼喧鼓吹，帝城车马走骈阗。羁馆独凄然。燕塞月，缺了又还圆。万里妾心愁更苦，十春和泪看婵娟。何日是归年。|宋|望江南·燕塞雪
559|孟浩然|水亭凉气多，闲棹晚来过。涧影见松竹，潭香闻芰荷。野童扶醉舞，山鸟助酣歌。幽赏未云遍，烟光奈夕何。|唐|夏日浮舟过陈大水亭
560|万俟咏|短长亭。古今情。楼外凉蟾一晕生。雨馀秋更清。暮云平。暮山横。几叶秋声和雁声。行人不要听。|宋|长相思·山驿
561|孙光宪|蓼岸风多橘柚香。江边一望楚天长。片帆烟际闪孤光。目送征鸿飞杳杳，思随流水去茫茫。兰红波碧忆潇湘。|五代|浣溪沙·蓼岸风多橘柚香
562|柳永|拆桐花烂漫，乍疏雨、洗清明。正艳杏烧林，缃桃绣野，芳景如屏。倾城，尽寻胜去，骤雕鞍绀幰出郊坰。风暖繁弦脆管，万家竞奏新声。盈盈，斗草踏青。人艳冶，递逢迎。向路旁往往，遗簪堕珥，珠翠纵横。欢情，对佳丽地，信金罍罄竭玉山倾。拚却明朝永日，画堂一枕春酲。|宋|木兰花慢·拆桐花烂熳
563|卢照邻|关山客子路，花柳帝王城。此中一分手，相顾怜无声。|唐|送二兄入蜀
564|张蠙|兵罢淮边客路通，乱鸦来去噪寒空。可怜白骨攒孤冢，尽为将军觅战功。|唐|吊万人冢
565|姜夔|冷红叶叶下塘秋。长与行云共一舟。零落江南不自由。两绸缪。料得吟鸾夜夜愁。|宋|忆王孙·番阳彭氏小楼作
566|佚名|我车既攻，我马既同。四牡庞庞，驾言徂东。田车既好，田牡孔阜。东有甫草，驾言行狩。之子于苗，选徒嚣嚣。建旐设旄，搏兽于敖。驾彼四牡，四牡奕奕。赤芾金舄，会同有绎。决拾既佽，弓矢既调。射夫既同，助我举柴。四黄既驾，两骖不猗。不失其驰，舍矢如破。萧萧马鸣，悠悠旆旌。徒御不惊，大庖不盈。之子于征，有闻无声。允矣君子，展也大成。|先秦|车攻
567|辛弃疾|松冈避暑。茅檐避雨。闲去闲来几度。醉扶孤石看飞泉，又却是、前回醒处。东家娶妇。西家归女。灯火门前笑语。酿成千顷稻花香，夜夜费、一天风露。|宋|鹊桥仙·己酉山行书所见
568|元结|序：漫叟以公田米酿酒，因休暇，则载酒于湖上，时取一醉。欢醉中，据湖岸，引臂向鱼取酒，使舫载之，偏饮坐者。意疑倚巴丘酌于君山之上，诸子环洞庭而坐，酒舫泛泛然触波涛而往来者。乃作歌以长之。石鱼湖，似洞庭，夏水欲满君山青。山为樽，水为沼，酒徒历历坐洲岛。长风连日作大浪，不能废人运酒舫。我持长瓢坐巴丘，酌饮四坐以散愁。|唐|石鱼湖上醉歌
569|陈师道|平林广野骑台荒，山寺钟鸣报夕阳。人事自生今日意，寒花只作去年香。巾欹更觉霜侵鬓，语妙何妨石作肠。落日无边江不尽，此身此日更须忙。|宋|次韵李节推九日登南山
570|佚名|既醉以酒，既饱以德。君子万年，介尔景福。既醉以酒，尔肴既将。君子万年，介尔昭明。昭明有融，高朗令终，令终有俶。公尸嘉告。其告维何？笾豆静嘉。朋友攸摄，摄以威仪。威仪孔时，君子有孝子。孝子不匮，永锡尔类。其类维何？室家之壶。君子万年，永锡祚胤。其胤维何？天被尔禄。君子万年，景命有仆。其仆维何？厘尔女士。厘尔女士，从以孙子。|先秦|既醉
571|杜审言|旅客三秋至，层城四望开。楚山横地出，汉水接天回。冠盖非新里，章华即旧台。习池风景异，归路满尘埃。|唐|登襄阳城
572|张玉娘|三十遴骁勇，从军事北荒。流星飞玉弹，宝剑落秋霜。书角吹杨柳，金山险马当。长驱空朔漠，驰捷报明王。|宋|从军行
573|戴叔伦|军门频纳受降书，一剑横行万里馀。汉祖谩夸娄敬策，却将公主嫁单于。汉家旌帜满阴山，不遣胡儿匹马还。愿得此身长报国，何须生入玉门关。|唐|塞上曲二首
574|佚名|驷驖孔阜，六辔在手。公之媚子，从公于狩。奉时辰牡，辰牡孔硕。公曰左之，舍拔则获。游于北园，四马既闲。輶车鸾镳，载猃歇骄。|先秦|驷驖
575|戴复古|轮奂半天上，胜概压南楼。筹边独坐，岂欲登览快双眸。浪说胸吞云梦，直把气吞残虏，西北望神州。百载一机会，人事恨悠悠。骑黄鹤，赋鹦鹉，谩风流。岳王祠畔，杨柳烟锁古今愁。整顿乾坤手段，指授英雄方略，雅志若为酬。杯酒不在手，双鬓恐惊秋。|宋|水调歌头·题李季允侍郎鄂州吞云楼
576|魏禧|生平四十老柴荆，此日麻鞋拜故京。谁使山河全破碎？可堪翦伐到园陵！牛羊践履多新草，冠盖雍容半旧卿。歌泣不成天已暮，悲风日夜起江生。|明|登雨花台
577|张蠙|边兵春尽回，独上单于台。白日地中出，黄河天外来。沙翻痕似浪，风急响疑雷。欲向阴关度，阴关晓不开。|唐|登单于台
578|赵长卿|年年为客遍天涯。梦迟归路赊。无端星月浸窗纱。一枝寒影斜。肠未断，鬓先华。新来瘦转加。角声吹彻小梅花。夜长人忆家。|宋|阮郎归·客中见梅
579|佚名|渐渐之石，维其高矣。山川悠远，维其劳矣。武人东征，不遑朝矣。渐渐之石，维其卒矣。山川悠远，曷其没矣？武人东征，不遑出矣。有豕白蹢，烝涉波矣。月离于毕，俾滂沱矣。武人东征，不皇他矣。|先秦|渐渐之石
580|吴文英|友人以梅、兰、瑞香、水仙供客，曰四香，分韵得风字。云深山坞，烟冷江皋，人生未易相逢。一笑灯前，钗行两两春容。清芳夜争真态，引生香、撩乱东风。探花手，与安排金屋，懊恼司空。憔悴欹翘委佩，恨玉奴销瘦，飞趁轻鸿。试问知心，尊前谁最情浓。连呼紫云|宋|声声慢·友人以梅兰瑞香水仙供客曰四香分韵得风字
581|毛滂|蝴蝶初翻帘绣。万玉女、齐回舞袖。落花飞絮蒙蒙，长忆著、灞桥别后。浓香斗帐自永漏。任满地、月深云厚。夜寒不近流苏，只怜他、后庭梅瘦。|宋|上林春令·十一月三十日见雪
582|司马相如|臣闻物有同类而殊能者，故力称乌获，捷言庆忌，勇期贲、育。臣之愚，窃以为人诚有之，兽亦宜然。今陛下好陵阻险，射猛兽，卒然遇逸材之兽，骇不存之地，犯属车之清尘，舆不及还辕，人不暇施巧，虽有乌获、逢蒙之技不能用，枯木朽枝尽为难矣。是胡越起于毂下，而羌夷接轸也，岂不殆哉！虽万全而无患，然本非天子之所宜近也。且夫清道而后行，中路而驰，犹时有衔橛之变。况乎涉丰草，骋丘虚，前有利兽之乐，而内无存变之意，其为害也不难矣。夫轻万乘之重不以为安，乐出万有一危之途以为娱，臣窃为陛下不取。盖明者远见于未萌，而知者避危于无形，祸固多藏于隐微而发于人之所忽者也。故鄙谚曰：“家累千金，坐不垂堂。”此言虽小，可以喻大。臣愿陛下留意幸察。|汉|上书谏猎
583|锺过|东风又送酴釄信，早吹得、愁成潘鬓。花开犹似十年前，人不似、十年前俊。水边珠翠香成阵。也消得、燕窥莺认。归来沈醉月朦胧，觉花气、满襟犹润。|清|步蟾宫·东风又送酴釄信
584|岑参|一身从远使，万里向安西。汉月垂乡泪，胡沙费马蹄。寻河愁地尽，过碛觉天低。送子军中饮，家书醉里题。|唐|碛西头送李判官入京
585|佚名|凫鹥在泾，公尸来燕来宁。尔酒既清，尔肴既馨。公尸燕饮，福禄来成。凫鹥在沙，公尸来燕来宜。尔酒既多，尔肴既嘉。公尸燕饮，福禄来为。凫鹥在渚，公尸来燕来处。尔酒既湑，尔肴伊脯。公尸燕饮，福禄来下。凫鹥在潀，公尸来燕来宗，既燕于宗，福禄攸降。公尸燕饮，福禄来崇。凫鹥在亹，公尸来止熏熏。旨酒欣欣，燔炙芬芬。公尸燕饮，无有后艰。|先秦|凫鹥
